<?xml version="1.0"?>
<!DOCTYPE entries PUBLIC "-//FreeBSD//DTD FreeBSD XML Database for Commercial Gallery//EN"
                         "http://www.FreeBSD.org/XML/www/share/sgml/gallery.dtd">
<!-- $FreeBSD$ -->

<entries>
  <cvs:keywords xmlns:cvs="http://www.FreeBSD.org/XML/CVS" version="1.0">
    <cvs:keyword name="freebsd">
      $FreeBSD$
    </cvs:keyword>
  </cvs:keywords>

  <entry id="FreeBSDMall">
    <name>FreeBSD Mall</name>
    <url>http://www.freebsdmall.com/</url>
    <description>
      The FreeBSD Mall can provide everything you may want or need to
      enhance your FreeBSD experience. Are you new to FreeBSD? Or, perhaps
      you've been using it for years? We have something for you. We have
      the latest FreeBSD CDROMs, helpful books, and colorful shirts and
      hats. Stay current with FreeBSD and put it to work for you!
    </description>
  </entry>

  <entry id="ScotGold">
    <name>ScotGold Products</name>
    <url>http://www.scotgold.com/acatalog/ScotGold_Catalogue_BSD_Daemon_Stuff_3.html</url>
    <description>
      ScotGold Products design and manufacture PC case badges, including a
      BSD daemon badge with the permission and blessing of Kirk McKusick.
    </description>
  </entry>

  <entry id="exavault">
    <name>ExaVault</name>
    <url>http://www.exavault.com</url>
    <description>
      ExaVault provides inexpensive online remote backup space that is
      accessible via open, industry standard protocols, including rsync,
      FTP and SFTP.  It is ideal for small and medium businesses, web
      hosting companies and others that need a quick, transparent,
      maintenance-free way of mirroring a copy of their data to a remote
      backup server.  We are fully FreeBSD compatible, and provide full
      support for getting things setup on your FreeBSD system. 
    </description>
  </entry>

  <entry id="gfuschulung">
    <name>GFU Schulung</name>
    <url>http://www.gfu.net/</url>
    <description>
      GFU offers
      <a href="http://www.gfu.net/seminare-schulungen-kurse/oracle_db_sprachen_design_sk38/freebsd_training_s856.html">FreeBSD Training</a>
      for customizing servers with a whole bunch of open source software
      like PostgreSQL, OpenOffice, Cyrus IMAP, etc.
      Upon customer request especially:
      <a href="http://www.gfu.net/seminare-schulungen-kurse/oracle_db_sprachen_design_sk38/oracle_unter_freebsd_s854.html">Oracle Administration under FreeBSD</a>.
    </description>
  </entry>
</entries>
